{
  "algorithm": "ed25519",
  "key_id": "KEY-SYNTH-ED25519-001",
  "payload_base64": "eyJidWlsZF90eXBlIjoiaHR0cHM6Ly9leGFtcGxlLmludmFsaWQvYnVpbGQtdHlwZXMvcHl0aG9uLXdoZWVsL3YxIiwiYnVpbGRlcl9pZGVudGl0eSI6InN5bnRoZXRpYy1idWlsZGVyOmdpdGh1Yi1hY3Rpb25zLXJlZmVyZW5jZSIsImZpbmlzaGVkX2F0IjoiMjAyNi0wMS0yMFQwMDowMjowMFoiLCJpbnZvY2F0aW9uX2lkIjoic3ludGhldGljLXJ1bjowMDAxIiwibWF0ZXJpYWxzIjpbeyJzaGEyNTYiOiJiYmJiYmJiYmJiYmJiYmJiYmJiYmJiYmJiYmJiYmJiYmJiYmJiYmJiYmJiYmJiYmJiYmJiYmJiYmJiYmJiYmJiIiwidXJpIjoic3ludGhldGljOi8vc291cmNlL3JlcG9zaXRvcnktdHJlZS50YXIifSx7InNoYTI1NiI6ImNjY2NjY2NjY2NjY2NjY2NjY2NjY2NjY2NjY2NjY2NjY2NjY2NjY2NjY2NjY2NjY2NjY2NjY2NjY2NjY2NjY2MiLCJ1cmkiOiJzeW50aGV0aWM6Ly9idWlsZC9kaXJlY3QtZGVwZW5kZW5jaWVzLmpzb24ifV0sInByb3ZlbmFuY2VfaWQiOiJQUk9WLVNZTlRILTAwMSIsInNjaGVtYV92ZXJzaW9uIjoidnVsbmV2aWRlbmNlb3BzLmJ1aWxkLXByb3ZlbmFuY2UudjEiLCJzb3VyY2VfY29tbWl0IjoiMTExMTExMTExMTExMTExMTExMTExMTExMTExMTExMTExMTExMTExMSIsInNvdXJjZV9yZWYiOiJyZWZzL2hlYWRzL3N5bnRoZXRpYy1yZWZlcmVuY2UiLCJzb3VyY2VfcmVwb3NpdG9yeSI6Imh0dHBzOi8vZXhhbXBsZS5pbnZhbGlkL3N5bnRoZXRpYy9WdWxuRXZpZGVuY2VPcHMiLCJzb3VyY2VfdHJlZSI6IjIyMjIyMjIyMjIyMjIyMjIyMjIyMjIyMjIyMjIyMjIyMjIyMjIyMjIiLCJzdGFydGVkX2F0IjoiMjAyNi0wMS0yMFQwMDowMDowMFoiLCJzdWJqZWN0X25hbWUiOiJ2dWxuZXZpZGVuY2VvcHMtMC41LjAtcHkzLW5vbmUtYW55LndobCIsInN1YmplY3Rfc2hhMjU2IjoiYWFhYWFhYWFhYWFhYWFhYWFhYWFhYWFhYWFhYWFhYWFhYWFhYWFhYWFhYWFhYWFhYWFhYWFhYWFhYWFhYWFhYSIsInN5bnRoZXRpYyI6dHJ1ZX0=",
  "payload_sha256": "8b6e1045f79c4f55ebe44ffc049229c8033b5f869cbb1692d809202c35899d93",
  "payload_type": "application/vnd.vulnevidenceops.build-provenance.v1+json",
  "schema_version": "vulnevidenceops.signed-evidence-envelope.v1",
  "signature_base64": "BWwUIxHZY5mxXTSPbHpxIeD4w0CvGwAv3a4MW6JSK61OFCfNBo6wgEBOWfu28iNypGgMDkpKMlL+Pg2YZCn5DQ==",
  "signed_at": "2026-01-20T00:03:00Z"
}
